      No    Time           Source                   Destination           Protocol Length   Info
      1 0.000000000    10.0.2.4              34.107.221.82         TCP      54     49540 → 80 [ACK] Seq=1 Ack=1 Win=64020 Len=0
      2 0.000805850    34.107.221.82         10.0.2.4              TCP      60     [TCP ACKed unseen segment] 80 → 49540 [ACK] Seq=1 Ack=2 Win=32472 Len=0
      3 0.000000000    10.0.2.4              34.107.221.82         TCP      56     [TCP Dup ACK 1#1] 49540 → 80 [ACK] Seq=1 Ack=1 Win=64020 Len=0
      4 0.000805850    34.107.221.82         10.0.2.4              TCP      62     [TCP Dup ACK 2#1] [TCP ACKed unseen segment] 80 → 49540 [ACK] Seq=1 Ack=2 Win=32472 Len=0
      5 0.255298184    10.0.2.4              34.107.221.82         TCP      54     49542 → 80 [ACK] Seq=1 Ack=1 Win=64020 Len=0
      6 0.256085271    34.107.221.82         10.0.2.4              TCP      60     [TCP ACKed unseen segment] 80 → 49542 [ACK] Seq=1 Ack=2 Win=32467 Len=0
      7 0.255298184    10.0.2.4              34.107.221.82         TCP      56     [TCP Dup ACK 5#1] 49542 → 80 [ACK] Seq=1 Ack=1 Win=64020 Len=0
      8 0.256085271    34.107.221.82         10.0.2.4              TCP      62     [TCP Dup ACK 6#1] [TCP ACKed unseen segment] 80 → 49542 [ACK] Seq=1 Ack=2 Win=32467 Len=0
      9 0.377619127    10.0.2.4              54.186.128.121        TLSv1.2  85     Encrypted Alert
     10 0.377751822    10.0.2.4              54.186.128.121        TCP      54     60118 → 443 [FIN, ACK] Seq=32 Ack=1 Win=62780 Len=0
     11 0.378551669    54.186.128.121        10.0.2.4              TCP      60     443 → 60118 [ACK] Seq=1 Ack=33 Win=32093 Len=0
     12 0.377619127    10.0.2.4              54.186.128.121        TLSv1.2  87     [TCP Spurious Retransmission] , Encrypted Alert
     13 0.377751822    10.0.2.4              54.186.128.121        TCP      56     [TCP Out-Of-Order] 60118 → 443 [FIN, ACK] Seq=32 Ack=1 Win=62780 Len=0
     14 0.378551669    54.186.128.121        10.0.2.4              TCP      62     [TCP Dup ACK 11#1] 443 → 60118 [ACK] Seq=1 Ack=33 Win=32093 Len=0
     15 0.644022338    54.186.128.121        10.0.2.4              TLSv1.2  85     Encrypted Alert
     16 0.644023033    54.186.128.121        10.0.2.4              TCP      60     443 → 60118 [FIN, ACK] Seq=32 Ack=33 Win=32093 Len=0
     17 0.644131490    10.0.2.4              54.186.128.121        TCP      54     60118 → 443 [RST] Seq=33 Win=0 Len=0
     18 0.644222470    10.0.2.4              54.186.128.121        TCP      54     60118 → 443 [RST] Seq=33 Win=0 Len=0
     19 0.644022338    54.186.128.121        10.0.2.4              TCP      87     [TCP Retransmission] 443 → 60118 [PSH, ACK] Seq=1 Ack=33 Win=32093 Len=31
     20 0.644023033    54.186.128.121        10.0.2.4              TCP      62     [TCP Out-Of-Order] 443 → 60118 [FIN, ACK] Seq=32 Ack=33 Win=32093 Len=0
     21 0.644131490    10.0.2.4              54.186.128.121        TCP      56     60118 → 443 [RST] Seq=33 Win=0 Len=0
     22 0.644222470    10.0.2.4              54.186.128.121        TCP      56     60118 → 443 [RST] Seq=33 Win=0 Len=0
     23 1.022727697    10.0.2.4              142.250.185.3         TCP      54     54712 → 80 [ACK] Seq=1 Ack=1 Win=63882 Len=0
     24 1.023763494    142.250.185.3         10.0.2.4              TCP      60     [TCP ACKed unseen segment] 80 → 54712 [ACK] Seq=1 Ack=2 Win=32386 Len=0
     25 1.022727697    10.0.2.4              142.250.185.3         TCP      56     [TCP Dup ACK 23#1] 54712 → 80 [ACK] Seq=1 Ack=1 Win=63882 Len=0
     26 1.023763494    142.250.185.3         10.0.2.4              TCP      62     [TCP Dup ACK 24#1] [TCP ACKed unseen segment] 80 → 54712 [ACK] Seq=1 Ack=2 Win=32386 Len=0
     27 1.055638296    10.0.2.4              35.163.112.241        TCP      56     34708 → 443 [ACK] Seq=1 Ack=1 Win=62780 Len=0
     28 1.056260790    35.163.112.241        10.0.2.4              TCP      62     [TCP ACKed unseen segment] 443 → 34708 [ACK] Seq=1 Ack=2 Win=31780 Len=0
     29 1.055638296    10.0.2.4              35.163.112.241        TCP      54     [TCP Dup ACK 27#1] 34708 → 443 [ACK] Seq=1 Ack=1 Win=62780 Len=0
     30 1.056260790    35.163.112.241        10.0.2.4              TCP      60     [TCP Dup ACK 28#1] [TCP ACKed unseen segment] 443 → 34708 [ACK] Seq=1 Ack=2 Win=31780 Len=0
     31 1.319979101    10.0.2.4              142.250.185.3         TCP      56     54722 → 80 [ACK] Seq=1 Ack=1 Win=63882 Len=0
     32 1.320321245    142.250.185.3         10.0.2.4              TCP      62     [TCP ACKed unseen segment] 80 → 54722 [ACK] Seq=1 Ack=2 Win=32386 Len=0
     33 1.319979101    10.0.2.4              142.250.185.3         TCP      54     [TCP Dup ACK 31#1] 54722 → 80 [ACK] Seq=1 Ack=1 Win=63882 Len=0
     34 1.320321245    142.250.185.3         10.0.2.4              TCP      60     [TCP Dup ACK 32#1] [TCP ACKed unseen segment] 80 → 54722 [ACK] Seq=1 Ack=2 Win=32386 Len=0
     35 1.374694211    10.0.2.4              93.184.220.29         TCP      54     52252 → 80 [ACK] Seq=1 Ack=1 Win=63920 Len=0
     36 1.378860866    93.184.220.29         10.0.2.4              TCP      60     [TCP ACKed unseen segment] 80 → 52252 [ACK] Seq=1 Ack=2 Win=31631 Len=0
     37 1.374694211    10.0.2.4              93.184.220.29         TCP      56     [TCP Dup ACK 35#1] 52252 → 80 [ACK] Seq=1 Ack=1 Win=63920 Len=0
     38 1.378860866    93.184.220.29         10.0.2.4              TCP      62     [TCP Dup ACK 36#1] [TCP ACKed unseen segment] 80 → 52252 [ACK] Seq=1 Ack=2 Win=31631 Len=0
     39 2.366843906    10.0.2.4              13.225.245.48         TCP      56     33076 → 443 [ACK] Seq=1 Ack=1 Win=65535 Len=0
     40 2.367363845    13.225.245.48         10.0.2.4              TCP      62     [TCP ACKed unseen segment] 443 → 33076 [ACK] Seq=1 Ack=2 Win=31831 Len=0
     41 2.366843906    10.0.2.4              13.225.245.48         TCP      54     [TCP Dup ACK 39#1] 33076 → 443 [ACK] Seq=1 Ack=1 Win=65535 Len=0
     42 2.367363845    13.225.245.48         10.0.2.4              TCP      60     [TCP Dup ACK 40#1] [TCP ACKed unseen segment] 443 → 33076 [ACK] Seq=1 Ack=2 Win=31831 Len=0
     43 2.815366795    10.0.2.4              13.225.245.48         TCP      54     33020 → 443 [ACK] Seq=1 Ack=1 Win=62780 Len=0
     44 2.815766736    13.225.245.48         10.0.2.4              TCP      60     [TCP ACKed unseen segment] 443 → 33020 [ACK] Seq=1 Ack=2 Win=32336 Len=0
     45 2.815366795    10.0.2.4              13.225.245.48         TCP      56     [TCP Dup ACK 43#1] 33020 → 443 [ACK] Seq=1 Ack=1 Win=62780 Len=0
     46 2.815766736    13.225.245.48         10.0.2.4              TCP      62     [TCP Dup ACK 44#1] [TCP ACKed unseen segment] 443 → 33020 [ACK] Seq=1 Ack=2 Win=32336 Len=0
     47 4.871286935    10.0.2.4              93.184.220.29         TCP      56     52276 → 80 [ACK] Seq=1 Ack=1 Win=63920 Len=0
     48 4.871842535    93.184.220.29         10.0.2.4              TCP      62     [TCP ACKed unseen segment] 80 → 52276 [ACK] Seq=1 Ack=2 Win=32389 Len=0
     49 4.871286935    10.0.2.4              93.184.220.29         TCP      54     [TCP Dup ACK 47#1] 52276 → 80 [ACK] Seq=1 Ack=1 Win=63920 Len=0
     50 4.871842535    93.184.220.29         10.0.2.4              TCP      60     [TCP Dup ACK 48#1] [TCP ACKed unseen segment] 80 → 52276 [ACK] Seq=1 Ack=2 Win=32389 Len=0
     51 5.055466147    10.0.2.4              54.186.128.121        TCP      56     60116 → 443 [ACK] Seq=1 Ack=1 Win=62780 Len=0
     52 5.055466147    10.0.2.4              54.186.128.121        TCP      54     [TCP Dup ACK 51#1] 60116 → 443 [ACK] Seq=1 Ack=1 Win=62780 Len=0
     53 5.056292603    54.186.128.121        10.0.2.4              TCP      60     [TCP ACKed unseen segment] 443 → 60116 [ACK] Seq=1 Ack=2 Win=32768 Len=0
     54 5.056292603    54.186.128.121        10.0.2.4              TCP      62     [TCP Dup ACK 53#1] [TCP ACKed unseen segment] 443 → 60116 [ACK] Seq=1 Ack=2 Win=32768 Len=0
     55 6.193986195    10.0.2.4              104.17.113.188        UDP      76     42515 → 33434 Len=32
     56 6.194156406    10.0.2.4              104.17.113.188        UDP      76     58126 → 33435 Len=32
     57 6.194276917    10.0.2.4              104.17.113.188        UDP      76     60490 → 33436 Len=32
     58 6.194414252    10.0.2.4              104.17.113.188        UDP      76     35114 → 33437 Len=32
     59 6.194687672    10.0.2.4              104.17.113.188        UDP      76     48524 → 33438 Len=32
     60 6.194719154    10.0.2.1              10.0.2.4              ICMP     72     Time-to-live exceeded (Time to live exceeded in transit)
     61 6.193986195    10.0.2.4              104.17.113.188        UDP      74     42515 → 33434 Len=32
     62 6.194156406    10.0.2.4              104.17.113.188        UDP      74     58126 → 33435 Len=32
     63 6.194276917    10.0.2.4              104.17.113.188        UDP      74     60490 → 33436 Len=32
     64 6.194414252    10.0.2.4              104.17.113.188        UDP      74     35114 → 33437 Len=32
     65 6.194687672    10.0.2.4              104.17.113.188        UDP      74     48524 → 33438 Len=32
     66 6.194719154    10.0.2.1              10.0.2.4              ICMP     70     Time-to-live exceeded (Time to live exceeded in transit)
     67 6.194719931    10.0.2.1              10.0.2.4              ICMP     70     Time-to-live exceeded (Time to live exceeded in transit)
     68 6.194720062    10.0.2.1              10.0.2.4              ICMP     70     Time-to-live exceeded (Time to live exceeded in transit)
     69 6.194804282    10.0.2.4              104.17.113.188        UDP      74     45609 → 33439 Len=32
     70 6.194896198    10.0.2.4              104.17.113.188        UDP      74     51156 → 33440 Len=32
     71 6.195242793    10.0.2.4              104.17.113.188        UDP      74     39263 → 33441 Len=32
     72 6.195505966    10.0.2.4              104.17.113.188        UDP      74     58408 → 33442 Len=32
     73 6.195643507    10.0.2.4              104.17.113.188        UDP      74     34591 → 33443 Len=32
     74 6.195756741    10.0.2.4              104.17.113.188        UDP      74     56086 → 33444 Len=32
     75 6.195876444    10.0.2.4              104.17.113.188        UDP      74     48099 → 33445 Len=32
     76 6.195987425    10.0.2.4              104.17.113.188        UDP      74     38795 → 33446 Len=32
     77 6.196133771    10.0.2.4              104.17.113.188        UDP      74     35739 → 33447 Len=32
     78 6.196261353    10.0.2.4              104.17.113.188        UDP      74     49589 → 33448 Len=32
     79 6.196382501    10.0.2.4              104.17.113.188        UDP      74     34379 → 33449 Len=32
     80 6.196917606    10.0.2.4              104.17.113.188        UDP      74     35603 → 33450 Len=32
     81 6.197084710    10.0.2.4              104.17.113.188        UDP      74     40313 → 33451 Len=32
     82 6.197228123    10.0.2.4              104.17.113.188        UDP      74     45260 → 33452 Len=32
     83 6.194719931    10.0.2.1              10.0.2.4              ICMP     72     Time-to-live exceeded (Time to live exceeded in transit)
     84 6.194720062    10.0.2.1              10.0.2.4              ICMP     72     Time-to-live exceeded (Time to live exceeded in transit)
     85 6.194804282    10.0.2.4              104.17.113.188        UDP      76     45609 → 33439 Len=32
     86 6.194896198    10.0.2.4              104.17.113.188        UDP      76     51156 → 33440 Len=32
     87 6.195242793    10.0.2.4              104.17.113.188        UDP      76     39263 → 33441 Len=32
     88 6.195505966    10.0.2.4              104.17.113.188        UDP      76     58408 → 33442 Len=32
     89 6.195643507    10.0.2.4              104.17.113.188        UDP      76     34591 → 33443 Len=32
     90 6.195756741    10.0.2.4              104.17.113.188        UDP      76     56086 → 33444 Len=32
     91 6.195876444    10.0.2.4              104.17.113.188        UDP      76     48099 → 33445 Len=32
     92 6.195987425    10.0.2.4              104.17.113.188        UDP      76     38795 → 33446 Len=32
     93 6.196133771    10.0.2.4              104.17.113.188        UDP      76     35739 → 33447 Len=32
     94 6.196261353    10.0.2.4              104.17.113.188        UDP      76     49589 → 33448 Len=32
     95 6.196382501    10.0.2.4              104.17.113.188        UDP      76     34379 → 33449 Len=32
     96 6.196917606    10.0.2.4              104.17.113.188        UDP      76     35603 → 33450 Len=32
     97 6.197084710    10.0.2.4              104.17.113.188        UDP      76     40313 → 33451 Len=32
     98 6.197228123    10.0.2.4              104.17.113.188        UDP      76     45260 → 33452 Len=32
     99 10.238959915   10.0.2.4              34.107.221.82         TCP      56     [TCP Dup ACK 1#2] 49540 → 80 [ACK] Seq=1 Ack=1 Win=64020 Len=0
    100 10.239302478   34.107.221.82         10.0.2.4              TCP      62     [TCP Dup ACK 2#2] [TCP ACKed unseen segment] 80 → 49540 [ACK] Seq=1 Ack=2 Win=32472 Len=0
    101 10.238959915   10.0.2.4              34.107.221.82         TCP      54     [TCP Dup ACK 1#3] 49540 → 80 [ACK] Seq=1 Ack=1 Win=64020 Len=0
    102 10.239302478   34.107.221.82         10.0.2.4              TCP      60     [TCP Dup ACK 2#3] [TCP ACKed unseen segment] 80 → 49540 [ACK] Seq=1 Ack=2 Win=32472 Len=0
    103 10.495384232   10.0.2.4              34.107.221.82         TCP      54     [TCP Dup ACK 5#2] 49542 → 80 [ACK] Seq=1 Ack=1 Win=64020 Len=0
    104 10.495686849   34.107.221.82         10.0.2.4              TCP      60     [TCP Dup ACK 6#2] [TCP ACKed unseen segment] 80 → 49542 [ACK] Seq=1 Ack=2 Win=32467 Len=0
    105 10.495384232   10.0.2.4              34.107.221.82         TCP      56     [TCP Dup ACK 5#3] 49542 → 80 [ACK] Seq=1 Ack=1 Win=64020 Len=0
    106 10.495686849   34.107.221.82         10.0.2.4              TCP      62     [TCP Dup ACK 6#3] [TCP ACKed unseen segment] 80 → 49542 [ACK] Seq=1 Ack=2 Win=32467 Len=0
